{
  "schema_version": 1,
  "input": "CONTCAR.co",
  "output": "highlight.png",
  "report": "highlight-report.json",
  "no_user_config": true,
  "json_errors": true,
  "config": {
    "schema_version": 1,
    "image": {
      "width": 900,
      "height": 700,
      "style": "illustrated",
      "aa": "2x",
      "background": "#ffffff",
      "png_encoder": "libpng",
      "png_compression": 6
    },
    "camera": {
      "view": "top"
    },
    "geometry": {
      "expand_xy": [
        1,
        1
      ],
      "image_colors": "greyscale"
    },
    "overlays": {
      "legend": true,
      "axes": true
    },
    "atom_overrides": [
      {
        "select": {
          "source_indices": [
            6,
            34
          ]
        },
        "color": "#ee6633",
        "radius_A": 0.95
      },
      {
        "select": {
          "source_indices": [
            6
          ],
          "cell": [
            1,
            0,
            0
          ]
        },
        "color": "#18a88b",
        "radius_A": 1.15
      }
    ]
  }
}
